{"year":2025,"displayName":"2025","startDate":"2025-04-14T07:00:00.000+00:00","endDate":"2025-10-20T06:59:00.000+00:00","types":[{"id":"1","type":1,"name":"Preseason","startDate":"2025-04-14T07:00:00.000+00:00","endDate":"2025-05-15T06:59:00.000+00:00"},{"id":"2","type":2,"name":"Regular Season","startDate":"2025-05-15T07:00:00.000+00:00","endDate":"2025-09-12T06:59:00.000+00:00"},{"id":"3","type":3,"name":"Postseason","startDate":"2025-09-12T07:00:00.000+00:00","endDate":"2025-10-20T06:59:00.000+00:00"},{"id":"4","type":4,"name":"Off Season","startDate":"2025-10-20T07:00:00.000+00:00","endDate":"2026-05-01T06:59:00.000+00:00"}]}