{"year":2025,"displayName":"2024-25","startDate":"2024-07-06T04:00:00.000+00:00","endDate":"2025-06-30T03:59:00.000+00:00","types":[{"id":"1","type":1,"name":"Preseason","startDate":"2024-07-06T04:00:00.000+00:00","endDate":"2025-01-10T04:59:00.000+00:00"},{"id":"2","type":2,"name":"Regular Season","startDate":"2025-01-10T05:00:00.000+00:00","endDate":"2025-05-29T03:59:00.000+00:00"},{"id":"3","type":3,"name":"Regionals","startDate":"2025-05-29T04:00:00.000+00:00","endDate":"2025-06-05T03:59:00.000+00:00"},{"id":"4","type":4,"name":"Super Regionals","startDate":"2025-06-05T04:00:00.000+00:00","endDate":"2025-06-10T03:59:00.000+00:00"},{"id":"5","type":5,"name":"World Series","startDate":"2025-06-10T04:00:00.000+00:00","endDate":"2025-06-20T03:59:00.000+00:00"},{"id":"6","type":6,"name":"Championship Series","startDate":"2025-06-20T04:00:00.000+00:00","endDate":"2025-06-30T03:59:00.000+00:00"}]}